Title,Description,LocationName
"Castelo de Bragança","O Castelo de Bragança, um dos mais representativos da arquitetura medieval, foi construído em 1409 por ordem de D. João I, sobre as fundações do tempo do primeiro rei de Portugal, D. Afonso Henriques.<br>Composto por uma imponente Torre de Menagem e por uma muralha dupla, o conjunto está muito bem conservado e a praça de armas, conhecida por cidadela ou vila, onde fica a Igreja de Santa Maria e a Domus Municipalis, mantém o velho casario medieval de ruas estreitas e pequenas casas caiadas de branco.<br>As muralhas são formadas por 15 torres e 3 portas, onde se destacam a Torre da Princesa, antiga dependência da Casa dos Alcaides que guarda a lenda de uma princesa feita prisioneira, e a Porta da Vila que acolhe o visitante ao castelo.<br>Na Torre de Menagem, com 17 metros de lado e 33 m de altura, merecem referência alguns elementos artísticos góticos, nomeadamente as ameias, as janelas e a pedra de armas da Casa Real de Avis, fundada por D. João I. Vale a pena subir até ao último piso, pela vista sobre a cidade e a paisagem envolvente.<br>No interior da Torre, com cinco pisos, está instalado o Museu Militar. Foi fundado em 1932, por iniciativa do coronel António José Teixeira, comandante do Regimento de Infantaria nº 10 aquartelado na cidadela desde meados do séc. XIX.<br>O espólio é constituído pela coleção particular de António José Teixeira e por peças doadas pelos militares que tinham participado em campanhas de unidades militares sediadas em Bragança, nomeadamente as de África e de França durante a 1ª Guerra Mundial. O conjunto ilustra a evolução do armamento ligeiro entre os séculos XII e XX.",Bragança
"Ponte Romana de Trajano","Ponte construída em granito, no período da Romanização, e formada por dezoito arcos, embora atualmente só estejam visíveis doze. Parte integrante da via romana XVII, ligava Bracara Augusta (Braga) a Asturica (Astorga), por Aquae Flavieae (Chaves). Nesta ponte existem duas colunas comemorativas do tempo dos imperadores romanos Titus Flavius Vespasiano e Marco Ulpio Trajano. Terá sido na vigência de Trajano, no ano de 104 d.C, que se concluiu a primeira das duas colunas, dando início à edificação da ponte.",Chaves
"Torre de menagem do Castelo de Chaves","O que resta da fortificação medieval foi edificado no período gótico, possivelmente no século XIII. D. Afonso III passou foral à povoação em 1258 e é a este monarca que se atribui o projeto defensivo baixo-medieval. Do antigo castelo medieval conserva a torre de menagem, de planta quadrangular, com fachadas sigladas, terminadas em parapeito e ameias prismáticas, tendo no topo balcões retangulares e nos ângulos balcões circulares, assentes em mísulas escalonadas e com matacães, rasgadas por frestas simples e bíforas, acedida a nível elevado, por portal em arco de volta perfeita, encimado pelas armas de Portugal, e troço de muralhas de planta retangular a envolver parcialmente a torre, com adarve e balcões. No séc. XVII foi transformado numa fortaleza abaluartada, de planta irregular, da qual são visíveis algumas cortinas, com a escarpa exterior em talude, possuindo cordão e terminando em parapeito, tendo nos ângulos do baluarte da Amoreira balcões poligonais salientes e no baluarte do Castelo guaritas poligonais. A par destas foram construídos o Forte de São Neutel e São Francisco, transformando assim, a cidade de Chaves na maior Praça Forte de Trás-os-Montes, uma das mais importantes da raia.",Chaves
"Castelo e Torre de Santo Estêvão","As referências iniciais a este local datam do século XI e mencionam uma propriedade rural de grandes dimensões, eventualmente fortificada. Durante dezanove anos, a fortaleza esteve na posse do monarca Afonso IX de Leão, após conquista no processo de defesa de sua filha, Infanta D. Teresa, sendo restituída à coroa portuguesa em 1231, quando se celebra o acordo de paz do Sabugal. A posição estratégica de Santo Estêvão determinou que alguns dos contactos entre as duas coroas passassem por aqui, tal como em 1253 quando D. Afonso III recebe a sua futura esposa, D. Beatriz.",Chaves
"Forte de São Neutel","Forte seiscentista de planta estrelada, composta por quatro baluartes regulares, inspirado no sistema de Vauban. A sua planta é semelhante ao vizinho Forte de São Francisco. Destaca-se o fosso interno e no centro da praça de armas a Capela da Nossa Senhora das Brotas. Os muros são de granito com espessura mínima de 1 metro, e a sua altura varia entre 7 e 10 metros. Para além da Guerra da Restauração foi, ainda, palco de combate, aquando das incursões monárquicas, entre forças civis, militares e o regime republicano, no ano de 1912.",Chaves
"Castelo de Monforte de Rio Livre","A maior parte do conjunto atualmente edificado do Castelo de Monforte de Rio Livre data de finais do século XIII e primeira metade do seguinte. O seu nome provém de um antigo concelho medieval que terá sido extinto no século XIX.  Depois de passada a carta de foral de D. Afonso III, em 1273, a (re)construção da fortaleza continuou pelo reinado de D. Dinis concluindo-se na primeira metade do século XIV, altura em que se documenta a presença de um alcaide na localidade e se verifica um forte crescimento do espaço urbano. A torre de menagem é o principal elemento remanescente e aquele que confere ao castelo a imagem militar por excelência.O Castelo de Monforte de Rio Livre faz parte da linha de defesa de Trás-os-Montes, sendo um ponto de vigia próximo da via romana de Bracara Augusta. ",Águas Frias
"Museu Nacional Ferroviário - Núcleo de Macinhata do Vouga","Localizado em Macinhata do Vouga, no Município de Águeda, o Museu Nacional Ferroviário é um espaço que retrata a história da ligação que existiu até 1990, entre Viseu e Espinho. Aqui é possível ver várias locomotivas das companhias ferroviárias Nacionais e do Vale do Vouga. Dos vários veículos que compõem a exposição permanente, destacam-se as Automotoras Nacionais ME 51 e ME 53. Este espaço localiza-se na Linha do Vouga, a única linha ferroviária de via estreita que ainda se encontra em funcionamento em território Nacional.",Águeda
"Pateira de Fermentelos","A Pateira de Fermentelos faz parte da bacia hidrográfica do rio Cértima e é a maior lagoa Natural da Península Ibérica. Esta zona protegida, incluída na Rede Natura 2000, é um espaço com uma diversidade em termos de fauna e flora únicas e são várias as espécies que poderá observar no seu habitat natural. A Garça-vermelha, a Águia-sapeira ou o Milhafre-preto, são apenas algumas das espécies que poderá encontrar na pateira, um local de excelência para a observação de aves. O seu valor natural e impacto na comunidade local, fazem da Pateira de Fermentelos um local imperdível numa visita à região.","Águeda, Aveiro, Oliveira do Bairro"
"Igreja de São Salvador da Trofa – Panteão de Lemos","Classificada como Monumento Nacional, a Igreja dedicada a São Salvador, é um templo de planta retangular que sofreu várias reformulações ao longo dos séculos. No seu interior, merece destaque a capela-mor, com cobertura em abobada de nervuras, quatro bocetes nos fechos secundários e um maior no centro, é neste espaço que se encontram os túmulos da Capela Funerária Lemos, datados do século XVI. O Panteão de Lemos destaca-se pela sua riqueza escultórica e decorativa e esteve na origem da classificação deste monumento como de interesse Nacional.",Trofa
"Parque da Alta Vila","Classificado como imóvel de interesse Público, o Parque da Alta Vila é local de destaque na região pela sua arquitetura revivalista. Por todo o Parque, são várias as guaritas e ameias esculpidas nos muros, que comprovam a motivação romântica e revelam as influências medievais deste espaço. No interior do parque é possível descobrir pequenas pontes, lagos e plantações de árvores exóticas que encantam qualquer visitante. ",Águeda
"Parque Fluvial do Alfusqueiro","O Parque Fluvial do Alfusqueiro é um dos vários parques fluviais do Município de Águeda onde é possível desfrutar de uma bela paisagem e refrescar-se nos dias de calor. Próximo da ponte do rio Alfusqueiro, este espaço disponibiliza aos banhistas lugares de sombra, com relva e areia fina, reunindo as condições ideias para usufruir da frescura das águas do rio.","Préstimo e Macieira de Alcôba"
"Miradouro do Monte Santo","Localizado no conhecido Pico da Figueira, o Miradouro do Monte Santo fica junto da pitoresca Ermida de Nossa Senhora do Monte Santo. Deste local é possível observar a Vila de Água de Pau, de um lado, e a  deslumbrante paisagem natural da Ilha, do outro. ",Água de Pau
"Miradouro e Área de lazer de Água de Pau","Localizado no Município de Lagoa, o Miradouro de Água de Pau é um local que deslumbra qualquer visitante com a paisagem sobre a Vila de Água e a Ermida de Nossa Senhora do Monte Santo.",Água de Pau
"Piscinas Naturais da Lagoa","Situadas na freguesia do Rosário, as Piscinas Naturais de Lagoa são um local de referência na ilha. Neste local é possível usufruir de várias piscinas naturais, de uma piscina artificial semiolímpica e de piscinas para crianças. Para além disso, o espaço está equipado com bar, esplanada, vestiários, WC e parque de estacionamento.",Rosário
"Igreja Matriz de Santa Cruz","A Igreja Matriz de Santa Cruz, outrora Ermida fundada por Rodrigo Afonso, sofreu várias alterações ao longo dos anos, muito justificadas pelo crescimento populacional que ocorreu durante o século XVIII. Com três naves, e a cabeceira escalonada, viu a sua frontaria reformulada no ano de 1844, tendo a torre sineira sido construída no mesmo ano. A intervenção realizada nesse ano, conferiu-lhe a configuração das restantes igrejas açorianas, que permitem observar no exterior as naves existentes no interior. Na ornamentação predominam retábulos de estilo barroco. Neste espaço, para além das funções próprias de um templo religioso, é possível visitar a Coleção da Matriz de Lagoa, disponibilizando aos visitantes a oportunidade de percorrer vários espaços musealizados no interior da Igreja. ",Santa Cruz
"Observatório Vulcanológico e Geotérmico dos Açores","O Observatório Vulcanológico e Geotérmico dos Açores é um espaço que tem como objetivo a divulgação da vulcanologia, da sismologia, da geotermia e dos desambientes dos Açores. Aqui o visitante poderá descobrir a geologia da região e observar várias amostras de rochas e minerais, bem como alguns fosseis, que deixam qualquer visitante curioso pelos exemplares únicos que existem na região.  ",Atalhada
"Pelourinho","Símbolo do poder de jurisdição e autonomia, o Pelourinho encontrava-se em frente à Domus Municipalis, edifício com que estaria em consonância dada a sua relação com o poder municipal. Foi mudado em 1860 para a praça de São Tiago, onde agora se encontra. É constituído por duas peças de cronologias díspares, o pelourinho propriamente dito, presumivelmente do século XIII, e a sua base, uma interessante figura zoomórfica proto-histórica, com mais de 2500 anos, popularmente designada como ""Porca da Vila"".",Bragança
"Domus Municipalis","Importante exemplar do período tardo-medieval, a Domus Municipalis é o principal ex-libris da cidade. Monumento singular e enigmático da arquitetura românica civil, único na Península Ibérica, foi edificado, muito provavelmente, no primeiro terço de quatrocentos.A Domus é constituída por dois espaços distintos, a ""sala de água"", uma cisterna de boa construção com o objetivo utilitário de armazenar águas pluviais e nascentes, e um espaço arquitetónico superior, designado como ""casa da Câmara"", denominação que indicia que aqui, ter-se-ão realizado, a partir do século XVI, as reuniões dos ""homens-bons"", membros da comunidade com alguma relevânciasocial ou económica, para debater os problemas da municipalidade.",Bragança
"Cidadela","A cidadela de Bragança, um recinto muralhado no cume do outeiro da antiga Quinta de Benquerença e o núcleo urbano mais antigo da cidade, nasce com o início da nacionalidade e devido à sua proximidade da fronteira. A primeira fortificação neste local deverá remontar à época do 1.º foral da cidade, concedido pelo rei D. Sancho I em 1187. No século seguinte, ergue-se o primeiro castelo, por ordem do rei D. Dinis, a partir do qual se desenvolveu o atual. Nas centúrias que se seguiram, a povoação foi completamente cercada por muralhas, estando totalmente envolvida por uma linha de defesa em 1377. A Fonte d'el rei e os panos de muralha que a cercam, datando provavelmente do século XV, durante o reinado de D. Afonso V, garantia o abastecimento de água no interior da povoação. O conjunto monumental da cidadela, com destaque para o Castelo, o Pelourinho e a Domus Municipalis foi, através dos tempos, uma forte presença da portugalidade junto à fronteira.",Bragança
"Museu Nacional Ferroviário de Bragança","O Museu Nacional Ferroviário de Bragança, inaugurado em abril de 2019, localiza-se na antiga estação de caminhos-de-ferro da cidade e ocupa o edifício anteriormente destinado ao parqueamento de carruagens daquela que foi a estação terminal da Linha do Tua. Aqui reúnem-se mais de duas centenas de peças que fizeram parte do quotidiano de ferroviários e passageiros da Linha do Tua. Este espaço é, assim, um lugar de memória da antiga linha de caminhos-de-ferro da região, que deixou de servir a população de Bragança em1992.",Bragança
"Biblioteca Municipal e Biblioteca Adriano Moreira","Parte integrante do Convento de Freiras Claras, este edifício foi construído no ano de 1562 e posteriormente entregue à Companhia de Jesus, responsável por aqui fundar um prestigiado Colégio que, em muito, contribuiu para a educação da sociedade brigantina.Manteve as suas funções educativas até finais do século XX, tendo o edifício sido recuperado pelo Município com o intuito de aqui instalar vários equipamentos, entre eles a Biblioteca Municipal. Em 2009, o Presidente da República Aníbal Cavaco Silva, inaugurou a Biblioteca Adriano Moreira, espaço que acolhe o acervo doado à comunidade brigantina pelo Professor Adriano Moreira.",Bragança
"Convento de São Francisco","Construído no século XIII, o Convento de São Francisco foi fundado para albergar a ordem mendicante de São Francisco. A tradição popular atribui a sua fundação ao próprio São Francisco de Assis mas, na realidade, o convento nasceu da vontade de uma família nobre, apoiada pela família real, como comprova uma doação testamentária de 1271, do rei D. Afonso III. O complexo conventual foi reedificado na primeira metade do século XVII, como denuncia o seu portal maneirista.O convento sofreu inúmeras intervenções nos séculos seguintes e uma vasta readaptação, depois da extinção das ordens religiosas, em 1834, para a instalação do Hospital Militar e do Asilo Duque de Bragança. Na igreja, de entre os vários retábulos setecentistas, destaca-se o da capela de Nossa Senhora da Conceição em que são visíveis algumas aplicações rocaille. No altar-mor é possível observar pinturas murais de elevado valor, nomeadamente a representação de Nossa Senhora do Manto, temática que viria a identificar as Misericórdias.",Bragança
"Miradouro de São Bartolomeu","Localizado a sul da cidade de Bragança, o Miradouro de São Bartolomeu oferece uma inesquecível e privilegiada vista da cidade e da sua envolvência, com destaque para a cidadela. O topónimo do Cabeço de São Bartolomeu provém do santuário que aqui se encontra, dedicado a São Bartolomeu. Junto a este local, ergue-se uma estátua de grandes dimensões em homenagem a São Bento, padroeiro da Diocese de Bragança-Miranda e da Europa. A ampla visibilidade que o cabeço oferece terá motivado a fixação humana neste local há milhares de anos, acreditando-se que aqui existiu um povoado fortificado pré-histórico.",Bragança
"Centro de Ciência Viva","A construção de uma cidadania ativa assente na promoção do conhecimento científico, com a educação e a disseminação da ciência e da tecnologia, é a principal missão do Centro Ciência Viva de Bragança. Agregado em dois espaços interativos, o Centro Ciência Viva oferece, no Edifício Sede, um espaço com temáticas expositivas pluridisciplinares relacionadas com as energias renováveis e com robótica e tecnologia de impressão 3D. Na Casa da Seda, instalada num antigo moinho, pode-se encontrar uma exposição relacionada com o património histórico, cultural e ecológico do bicho-da-seda na região e a exposição Natureza Virtual, com experiências imersivas assentes em tecnologia de Realidade Virtual.Em ambos os espaços destaca-se a interatividade das exposições, priorizando o envolvimento do cidadão em questões de extrema importância, nomeadamente a sustentabilidade energética e a preservação do meio ambiente.",Bragança
"Igreja de Santa Maria","Considerado um dos mais antigos templos da cidade de Bragança, a Igreja de Santa Maria deve remontar aos primórdios do burgo brigantino, século XI ou XII.Desta primitiva construção, dedicada, na voz popular, à Nossa Senhora do Sardão, não subsiste nenhum vestígio devido à reconstrução que todo o edifício sofreu no terceiro quartel de 1500. O resultado é, em grande parte, a igreja que hoje vemos, um amplo edifício com três naves, divididas por robustos arcos sustentados por colunas em tijoleira que contrastam com as paredes rebocadas a branco e os retábulos em talha dourada dos séculos seguintes. Na capela-mor, obra de finais do século XVI, destaca-se a sublime imagem seiscentista de Santa Maria Madalena, da escola de Valladolid. A frontaria da igreja, dos inícios do século XVIII, ostenta um elaborado portal de colunas torsas ou pseudo-salomónicas, sobre as quais surgem as figuras de São Pedro e de São Paulo.",Bragança
"Museu Ibérico da Máscara e do Traje","Fruto da cooperação transfronteiriça entre o Município de Bragança e a Diputación de Zamora, o museu encontra-se localizado no interior da cidadela do Castelo de Bragança, num edifício requalificado.Inaugurado a 24 de fevereiro de 2007, sob a temática da máscara, é um espaço de divulgação das tradições relacionadas com as festas de inverno e de carnaval de Trás-os-Montes e Alto Douro e da Província de Zamora.Constituído por 3 pisos, permite ao visitante contactar, em qualquer altura do ano, com uma multiplicidade de festas, personagens e rituais onde a máscara assume o papel primordial da festividade. Para além do contacto com as personagens recriadas pelos caretos expostos, o museu permite, ao som da música tradicional, levar o visitante a vivenciar, por fotografias e objetos expostos, as festividades representadas nas diferentes localidades durante o período de inverno.",Bragança
"Porta do Sol","Integrada na cerca muralhada do burgo brigantino, a Porta do Sol é assim designada por estar voltada a nascente, sendo iluminada pela primeira luz da manhã.As suas duas imponentes torres protegem a entrada na atual rua D. Fernão O Bravo, uma das principais artérias do espaço intramuros da cidade de Bragança. Do lado oposto da rua, ergue-se a Porta de Santo António e a Porta da Vila.",Bragança
"Portas da Vila","A entrada principal para a Cidadela de Bragança abre-se a poente da cerca muralhada pela Porta da Vila e faz parte da barbacã defensiva. Mais recuada, situada entre dois torreões, fica a Porta de Santo António, assim designada por possuir uma imagem desse Santo, sendo uma defesa adicional em caso de ataque.No extremo oposto da rua D. Fernão O Bravo abre-se a Porta do Sol. A norte destas e da Praça de Armas, encontra-se a Porta da Traição.",Bragança
"Solar dos Teixeiras","Construído como casa de habitação para uma família nobre e influente da sociedade brigantina, o Solar dos Teixeiras é um edifício de finais do século XVII.Ostenta no ângulo superior da cornija o brasão oitocentista, com as armas da família Teixeira, um escudo oval com cruz, encimado por um elmo e um unicórnio armado. O solar tem a particularidade de apresentar mezanino no andar superior da fachada voltada para a rua. As aberturas do andar nobre ostentam aventais, nos quais se lavram volumes tratados sob a forma de pontas de diamante. Em1988, o Solar foi adquirido pela Câmara Municipal de Bragança e recuperado para instalar a Biblioteca Dr. Águedo de Oliveira / Fundação ""Os Nossos Livros"", inaugurada a 30 de maio de 1996. Possui um notável acervo bibliográfico sobre o vinho do Porto.",Bragança
"Igreja de S. Bento","Fundado em 1590 por desejo de uma dama nobre, o Convento de São Bento foi, durante séculos, uma importante instituição religiosa da cidade de Bragança. Na fachada da igreja conventual ainda se encontra a pedra de armas da sua fundadora, D. Maria Teixeira.O convento, então sob a proteção de Santa Escolástica, foi extinto no século XIX, mas a sua igreja manteve-se aberta ao culto. A Igreja de São Bento ostenta, no seu interior, várias obras de relevo artístico, como a deslumbrante pintura cenográfica no teto da nave, com arquitetura fingida e perspectivas acentuadas que projetam o edifício para além da sua real altura. Na capela-mor, a par do retábulo joanino de 1721 com talha de estilo nacional, destaca-se o teto original de alfarge, uma autêntica relíquia de feição Mudéjar, datado dos fins de quinhentos.",Bragança
"Edifício do Principal","O Tenente-Coronel engenheiro Antas Machado projetou, em 1791, um edifício militar destinado a albergar a Guarda Principal. O local escolhido para a sua construção, com ligeiras alterações ao projeto original, foi a Praça de São Vicente.De características estilísticas sóbrias, sobressai a arcada da fachada principal, voltada para a praça. Atualmente, o edifício funciona como sede da ""Liga dos Combatentes"". No centro desta praça, também conhecida por Praça Velha, Praça de Baixo e Largo General Sepúlveda, encontra-se o Monumento aos Mortos da I Grande Guerra. Do lado oposto ao da igreja é visível um portal armoriado que nobilitava o edifício da antiga cadeia civil.",Bragança
"Igreja de S. Vicente","A igreja de São Vicente foi erigida, muito provavelmente, no início do século XIII.Pelas caraterísticas da cabeceira, tem-se enquadrado o primitivo templo no estilo românico. Destaca-se, no seu interior, a capela do Santo Cristo, seiscentista, sede da mais importante confraria da cidade com o mesmo nome. A existência desta confraria e a localização do templo, numa praça multifuncional, foram fatoresdecisivos para a preservação e beneficiação da igreja ao longo dos séculos.A talha dourada da capela-mor, datada do século XVIII, é uma admirável obra da arte barroca. De realçar, no seu exterior, o portal maneirista, o chafariz datado de 1746 que ostenta as armas reais e ainda o Passo oitocentista que demonstra a importância da Semana Santa em Bragança. O painel de azulejos, descerrado em 1929, comemora a proclamação do General Sepúlveda contra a invasão francesa em 1808. Crê-se que aqui tenha sido realizado o casamento secreto entre D. Pedro I e D. Inês de Castro, ligando este templo a uma das mais belas histórias de amor da época.",Bragança
"Santuário de Nossa Senhora das Graças","A igreja de Santa Clara, hoje mais conhecida como Santuário de Nossa Senhora das Graças, fez parte do extinto Convento de Santa Clara, destinado a acolher as filhas e netas dos cidadãos de Bragança. A construção do convento foi iniciada em 1569 e só em 1598 foi ocupado pelas freiras. Durante a Guerra da Restauração, alguma pedra e madeira da cerca e dos dormitórios do Convento, foram reutilizados para a construção das trincheiras da nova muralha na cidade. Só no início do século XVIII o convento finalmente adquire as condições necessárias para albergar a comunidade constituída por mais de uma centena de religiosas. Após a extinção das ordens religiosas, em 1834, o edifício fica devoluto e, em 26 de Agostode 1860, a Arquiconfraria de Nossa Senhora das Graças transfere-se para o local.A pintura cenográfica no teto da nave da igreja, atribuída a Manuel Xavier Caetano Fortuna, sublinha a devoção mariana, com Nossa Senhora ao centro, e valoriza a Palavra de Deus, com os quatro Evangelistas. Os vitrais e as imagens veneradas neste Santuário, Stº António, S. Francisco de Assis, S. Caetano, Stª Teresa de Ávila e Stª Clara, propõem um modelo de vida religiosa. Aqui encontramos a belíssima imagem de Nossa Senhora das Graças, padroeira da cidade.",Bragança
"Igreja da Misericórdia","A Santa Casa da Misericórdia de Bragança foi fundada em 1518 numa igreja já existente, a antiga igreja do Espírito Santo. A importância que a Santa Casa adquiriu, tal como aconteceu em todas as cidades do reino, impulsionou a necessidade de um templo próprio. A pequena igreja do Espírito Santo foi reconstruída em 1539 para servir como igreja da Misericórdia e, durante os séculos seguintes, foi embelezada com capelas, altares e imagens que demonstram a forte devoção promovida pela Santa Casa. O valioso retábulo maneirista no altar-mor, cuja figura central é Nossa Senhora da Misericórdia, foi executado nos finais do século XVII. Numa capela anexa pode admirar-se a preciosa imagem do Senhor dos Passos, dos fins do século XVIII. A frontaria do edifício foi revestida a azulejo entre1865 e 1873.",Bragança
