Title,Description,LocationName
"Igreja da Antiga Sé","A igreja da Antiga Sé, construída na primeira metade do século XVI e destinada a Convento de freiras Clarissas, acabaria por ser entregue aos padres da Companhia de Jesus em 1562, onde, em instalações anexas, fundaram um colégio. A igreja de uma só nave, reflete as reformas feitas pelos Jesuítas nos séculos XVI, XVII e XVIII.Apresenta uma arquitetura híbrida, com soluções estilísticas maneiristas e barrocas. Com a expulsão dos Jesuítas, em 1759, aqui se estabeleceu o Seminário Diocesano, em 1766. À igreja do colégio, foram atribuídas funções catedralícias em 1768. Merece visita atenta a sacristia, do século XVII, pela beleza da decoração, pela riqueza das pinturas no teto apainelado narrando a vida de Santo Inácio, epelos quadros que ladeiam o arcaz. Merecem ainda referência o claustro renascentista, a galilé toscana e o artístico e aparatoso janelão maneirista datado de 1685. No centro da Praça da Sé, ergue-se o Cruzeiro, a emblemática Cruz de Pedra, uma peça escultórica de fuste serpenteado, datada de 1689.",Bragança
"Memorial e Centro de Documentação Bragança Sefardita","Situado na ""Rua dos Museus"", o Memorial e Centro de Documentação Bragança Sefardita é um espaço que complementa e dialoga com o Centro de Interpretação da Cultura Sefardita do Nordeste Transmontano.Trata-se de uma abordagem mista, material e virtual, em que o espaço interior e a luz remetem para a memória.O visitante é acolhido numa sinagoga mostrando-se, didaticamente, a dimensão religiosa. O lugar da mulher, os ritos e as festas têm espaço consagrado nos restantes pisos, procurando-se sempre entender a dimensão da vida sefardita na cidade de Bragança. Paralelamente, neste equipamento, tem sede um arquivo de memória e um centro de documentação online que serve de apoio à reflexão e investigação em torno da presença sefardita na região de Bragança.",Bragança
"Centro de Arte Contemporânea Graça Morais","Instalado no antigo Solar dos Veiga Cabral, o Centro de Arte Contemporânea Graça Morais é constituído por um conjunto de três corpos distintos, obra da autoria de Eduardo Souto Moura, arquiteto premiado com o Prémio Pritzker. Tem como missão sensibilizar e promover o conhecimento da arte contemporânea, com particular ênfase na obra da pintora Graça Morais. A exposição é complementada com um dinâmico programa cultural, com exposições temporárias, coletivas e individuais, iniciativas de âmbito pluridisciplinar e atividades pedagógicas. Potencia-se, assim, a promoção, ampliação e fidelização de públicos interessados em arte contemporânea, ao mesmo tempo que se estreita a relação, já próxima, com a comunidade local.",Bragança
"Centro de Interpretação da Cultura Sefardita do Nordeste Transmontano","O Centro de Interpretação da Cultura Sefardita do Nordeste Transmontano, situado na Rua do Abade de Baçal, é um espaço que pretende dar a conhecer a história da comunidade judaica que habitou em Bragança e na região.O edifício, que alberga o Centro de Interpretação, é um exemplar da arquitetura civil da cidade, datado do século XVIII, que se crê ter pertencido a uma família de cristãos-novos. O espaço está organizado em três pisos, onde se abordam aspetos da vida quotidiana, da cultura e da religião dos judeus, com recurso a meios tecnológicos e a uma exposição de objetos e documentos. No rés-do-chão, o visitante é convidado a conhecer a história da presença judaica em Bragança, desde a Idade Média até à atualidade. No primeiro andar, é recriado um ambiente doméstico judaico, com a recriação de uma cozinha e de uma sala de jantar. No segundo andar, é abordada a dimensão religiosa, com a recriação de uma sinagoga e a exposição de objetos litúrgicos.",Bragança
"Museu do Abade de Baçal","O Museu do Abade de Baçal, instalado no antigo Paço Episcopal de Bragança, é um dos mais importantes museus do nordeste transmontano. O seu acervo é constituído por coleções de arqueologia, ourivesaria, numismática, epigrafia, escultura, pintura, desenho, mobiliário, têxteis e etnografia, provenientes, na sua maioria, do espólio do Abade de Baçal, figura incontornável da cultura brigantina. O museu está organizado em várias salas temáticas, onde se destacam a Sala do Abade de Baçal, a Sala de Arqueologia, a Sala de Ourivesaria, a Sala de Numismática, a Sala de Epigrafia, a Sala de Escultura, a Sala de Pintura, a Sala de Desenho, a Sala de Mobiliário, a Sala de Têxteis e a Sala de Etnografia. O museu possui, ainda, uma biblioteca especializada em história, arte e etnografia, e um arquivo histórico.",Bragança
"Parque Natural de Montesinho","O Parque Natural de Montesinho é uma área protegida de grande valor natural e paisagístico, localizada no nordeste de Portugal. Com uma área de cerca de 75.000 hectares, o parque abrange os concelhos de Bragança e Vinhais e é caracterizado pela sua diversidade de habitats, que incluem bosques de carvalhos, castanheiros, soutos, lameiros, prados de altitude e cursos de água. A fauna do parque é igualmente diversificada, com destaque para o lobo-ibérico, a corça, o javali, a águia-real, o bufo-real e a cegonha-preta. O parque oferece uma vasta rede de percursos pedestres, que permitem aos visitantes explorar a sua riqueza natural e cultural, com destaque para as aldeias típicas de Montesinho, Rio de Onor e Guadramil.",Bragança
"Aldeia de Montesinho","A aldeia de Montesinho, situada no coração do Parque Natural de Montesinho, é uma das mais emblemáticas aldeias do nordeste transmontano. Caracterizada pela sua arquitetura tradicional, com casas de granito e lousa, a aldeia mantém intacto o seu carácter rural e autêntico. O seu nome provém do monte que a domina, o Monte de Saninho, que oferece uma vista deslumbrante sobre a serra e as aldeias vizinhas. A aldeia é conhecida pela sua gastronomia, com destaque para a posta mirandesa, o fumeiro e o pão-de-centeio. Em Montesinho, os visitantes podem desfrutar de um ambiente tranquilo e sereno, longe do bulício das cidades, e contactar com as tradições e o modo de vida das gentes da terra.",Montesinho
"Aldeia de Rio de Onor","A aldeia de Rio de Onor, situada na fronteira com Espanha, é uma aldeia comunitária, onde as tradições se mantêm vivas e partilhadas por portugueses e espanhóis. A aldeia é atravessada pelo rio Onor, que serve de fronteira natural entre os dois países, e é conhecida pelo seu sistema comunitário de gestão dos recursos, como a água, os pastos e os bosques. As casas são de granito, com varandas em madeira e telhados de lousa, e as ruas são estreitas e empedradas. A aldeia possui um forno comunitário, um moinho e um lagar, que ainda são utilizados pelos habitantes. Rio de Onor é um exemplo único de convivência pacífica entre dois povos, unidos por uma história e uma cultura comuns.",Rio de Onor
"Castelo de Algoso","O Castelo de Algoso, situado no concelho de Vimioso, é um dos mais importantes castelos do nordeste transmontano. Erguido no topo de um imponente maciço rochoso, o castelo domina a paisagem envolvente e oferece uma vista panorâmica sobre o vale do Angueira e a serra de Bornes. A sua construção remonta ao século XII, tendo sido fundado por D. Mendo Rufino, um dos companheiros de D. Afonso Henriques. O castelo foi palco de vários episódios importantes da história de Portugal, como a resistência às invasões leonesas e castelhanas. Do conjunto fortificado, destacam-se a torre de menagem, de planta quadrangular, e as muralhas, que envolvem o recinto. O castelo está classificado como Monumento Nacional.",Algoso
"Barragem do Azibo","A Barragem do Azibo, situada no concelho de Macedo de Cavaleiros, é uma das mais importantes zonas de lazer do nordeste transmontano. A barragem, construída no rio Azibo, criou uma albufeira de grande beleza paisagística, rodeada por uma área protegida - a Paisagem Protegida da Albufeira do Azibo. A zona balnear da barragem, conhecida como Praia da Ribeira, é um local muito procurado para banhos, desportos náuticos e piqueniques. A área protegida oferece uma vasta rede de percursos pedestres e cicláveis, que permitem explorar a sua riqueza natural, com destaque para a flora mediterrânica e a fauna aquática. A barragem do Azibo é, assim, um local ideal para desfrutar da natureza e praticar atividades ao ar livre.",Macedo de Cavaleiros
"Termas de Chaves","As Termas de Chaves, situadas no coração da cidade, são conhecidas desde a época romana pelas suas águas minerais naturais, com propriedades terapêuticas. As águas, hipertermais (com temperaturas superiores a 70°C), são indicadas para o tratamento de doenças reumáticas, musculoesqueléticas e respiratórias. O complexo termal inclui um balneário termal, um spa e um parque termal, onde os visitantes podem desfrutar de banhos em piscinas de água quente, jacuzzis, saunas e banhos turcos. As termas são um local de eleição para quem procura relaxar e recuperar energias, num ambiente tranquilo e revitalizante. A cidade de Chaves oferece, ainda, um rico património histórico e cultural, com destaque para a ponte romana, o castelo e o museu da região flaviense.",Chaves
"Termas de Carvalhelhos","As Termas de Carvalhelhos, situadas no concelho de Boticas, são conhecidas pelas suas águas minerais naturais, com propriedades digestivas e diuréticas. As águas, bicarbonatadas sódicas, são engarrafadas e comercializadas em todo o país. O complexo termal inclui um balneário termal, um spa e um parque de merendas, onde os visitantes podem desfrutar de banhos em piscinas de água quente, tratamentos de bem-estar e atividades de lazer. As termas estão inseridas numa área de grande beleza natural, rodeada por bosques de carvalhos e castanheiros, ideal para caminhadas e piqueniques. As Termas de Carvalhelhos são um local de eleição para quem procura relaxar e usufruir dos benefícios das águas minerais, num ambiente sereno e acolhedor.",Boticas
"Parque Arqueológico do Vale do Tua","O Parque Arqueológico do Vale do Tua, situado no concelho de Alijó, é um espaço de divulgação e interpretação do património arqueológico da região. O parque inclui um centro de interpretação, onde são apresentados os resultados das escavações arqueológicas realizadas no vale do Tua, e um percurso arqueológico, que permite visitar os principais sítios arqueológicos da área. O vale do Tua é rico em vestígios arqueológicos, que testemunham a ocupação humana desde a Pré-História até à Idade Média, com destaque para as gravuras rupestres do Cachão da Rapa, os castros e as antas. O parque oferece, ainda, atividades pedagógicas e lúdicas, que visam sensibilizar os visitantes para a importância da preservação do património arqueológico.",Alijó
"Miradouro de São Lourenço","Localizado no Pico de São Lourenço, o Miradouro de São Lourenço oferece uma vista deslumbrante sobre a cidade de Peso da Régua e o vale do Douro. O miradouro, situado a 498 metros de altitude, permite avistar o rio Douro, as vinhas em socalco e as quintas produtoras de vinho do Porto. No local, ergue-se a capela de São Lourenço, um pequeno templo de origem medieval, que foi reconstruído no século XVIII. O miradouro é um local muito procurado para contemplar o pôr-do-sol e para fotografar a paisagem única do Alto Douro Vinhateiro, classificado como Património Mundial pela UNESCO. O acesso ao miradouro é feito por uma estrada sinuosa, que serpenteia pela encosta, oferecendo, ao longo do percurso, várias perspetivas sobre o vale.",Peso da Régua
"Estação Arqueológica do Cabeço do Vouga","A Estação Arqueológica do Cabeço do Vouga, situada no concelho de Águeda, é um importante sítio arqueológico que testemunha a ocupação humana desde a Idade do Ferro até à Idade Média. O sítio, identificado com a antiga cidade de Talábriga, mencionada nas fontes romanas, inclui vestígios de um castro, de uma villa romana e de uma necrópole medieval. As escavações arqueológicas realizadas no local permitiram identificar estruturas defensivas, habitações, termas e um fórum, que atestam a importância do povoado durante o período romano. A estação arqueológica está equipada com um centro de interpretação, onde são apresentados os resultados das investigações e os objetos encontrados nas escavações. O Cabeço do Vouga é um local de grande interesse histórico e arqueológico, que permite compreender a evolução do povoamento na região.",Águeda
"Paúl de Arzila","A Reserva Natural do Paúl de Arzila, situada no concelho de Montemor-o-Velho, é uma zona húmida de grande importância ecológica, que alberga uma diversidade de habitats e espécies. A reserva, integrada na Rede Natura 2000, é caracterizada por sapais, caniçais, juncais e lameiros, que proporcionam abrigo e alimento a uma avifauna rica e variada. Entre as espécies que podem ser observadas no Paúl de Arzila, destacam-se a garça-vermelha, o pato-real, o milhafre-preto, o pisco-de-peito-azul e o rouxinol-bravo. A reserva oferece um percurso pedestre, que permite explorar a sua riqueza natural, com vários observatórios de aves e painéis informativos. O Paúl de Arzila é um local ideal para os amantes da natureza e da observação de aves, proporcionando momentos de tranquilidade e contacto com a biodiversidade.",Arzila
"Farol de Aveiro","O Farol de Aveiro, também conhecido como Farol da Barra, é o farol mais alto de Portugal, com 62 metros de altura. Situado na praia da Barra, em Ílhavo, o farol foi inaugurado em 1893 e é um dos ex-libris da cidade de Aveiro. A sua torre, em forma de cilindro, é revestida a azulejos brancos e vermelhos, que a tornam inconfundível. O farol está aberto ao público, permitindo subir os 288 degraus até ao topo, de onde se desfruta de uma vista panorâmica sobre a ria de Aveiro, o oceano Atlântico e a costa. O farol é, ainda, um importante auxílio à navegação, emitindo um feixe de luz visível a 50 quilómetros de distância. A praia da Barra, com o seu extenso areal e as suas coloridas casas de pescadores, é um local muito procurado para banhos e desportos náuticos.",Aveiro
"Costa Nova","A Costa Nova, situada no concelho de Ílhavo, é conhecida pelas suas pitorescas casas riscadas, pintadas com cores vivas e listas horizontais. Originalmente, estas casas eram palheiros, utilizados pelos pescadores para guardar os apetrechos de pesca e as suas embarcações. Com o tempo, os palheiros foram transformados em casas de veraneio, mantendo a sua arquitetura característica. A Costa Nova oferece um extenso areal, ideal para caminhadas, banhos e desportos náuticos, como o surf e o kitesurf. A praia é, também, um local de eleição para a prática de birdwatching, dada a proximidade da ria de Aveiro e da sua rica avifauna. Os bares e restaurantes, especializados em peixe e marisco fresco, completam a oferta desta estância balnear, tornando-a um destino muito popular no verão.",Ílhavo
"Reserva Natural das Dunas de São Jacinto","A Reserva Natural das Dunas de São Jacinto, situada na península de São Jacinto, é uma área protegida que se estende ao longo do cordão dunar que separa a ria de Aveiro do oceano Atlântico. A reserva, criada em 1979, tem como objetivo a proteção dos ecossistemas dunares e dos habitats associados, como as matas de pinheiro-bravo, os prados húmidos e os sapais. A fauna da reserva inclui espécies como a raposa, o texugo, o ouriço-cacheiro, a garça-branca-pequena, o borrelho-de-coleira-interrompida e a andorinha-do-mar-anã. A reserva oferece um percurso pedestre, que permite explorar a sua diversidade paisagística e observar a sua riqueza faunística e florística. O acesso à península de São Jacinto é feito por barco, a partir de Aveiro, ou por estrada, através de uma ponte que a liga a Ovar.",São Jacinto
"Museu Marítimo de Ílhavo","O Museu Marítimo de Ílhavo, fundado em 1937, é um espaço dedicado à preservação e divulgação da cultura marítima da região de Aveiro. O museu, instalado num edifício moderno, inclui exposições permanentes e temporárias, que abordam temas como a pesca do bacalhau, a faina maior, a ria de Aveiro e a construção naval. O aquário de bacalhaus, um dos ex-libris do museu, permite observar exemplares vivos de bacalhau do Atlântico, numa recriação do seu habitat natural. O museu possui, ainda, uma biblioteca especializada em temas marítimos e um arquivo histórico, que reúne documentação relacionada com a pesca e a navegação. O Museu Marítimo de Ílhavo é um local de visita obrigatória para quem quer conhecer a forte ligação da região ao mar e à pesca.",Ílhavo
"Universidade de Aveiro","A Universidade de Aveiro, fundada em 1973, é uma das mais jovens e dinâmicas universidades portuguesas. O campus universitário, situado na periferia da cidade, é um exemplo de arquitetura moderna, com edifícios inovadores e espaços verdes. A universidade oferece uma vasta gama de cursos de licenciatura, mestrado e doutoramento, nas áreas das ciências, tecnologias, humanidades e artes. A biblioteca da universidade, com o seu design arrojado, é um dos edifícios mais emblemáticos do campus. A Universidade de Aveiro é, também, um importante centro de investigação, com vários laboratórios e unidades de I&D, que desenvolvem projetos em parceria com empresas e instituições nacionais e internacionais. A universidade contribui, decisivamente, para o desenvolvimento económico e cultural da região de Aveiro.",Aveiro
"Sé de Aveiro","A Sé de Aveiro, antiga Igreja do Convento de São Domingos, é um dos mais importantes monumentos religiosos da cidade. A igreja, construída no século XV, sofreu várias alterações ao longo dos séculos, adquirindo a sua atual feição barroca no século XVIII. No interior, destacam-se os altares em talha dourada, os azulejos historiados e o túmulo de Santa Joana Princesa, obra-prima da escultura renascentista portuguesa. A capela-mor, revestida a talha dourada, é um exuberante exemplo do estilo barroco joanino. A sé está classificada como Monumento Nacional e é um local de culto e de peregrinação, dada a devoção a Santa Joana, padroeira da cidade. O claustro do convento, de estilo renascentista, acolhe, atualmente, o Museu de Aveiro.",Aveiro
"Capela de São Gonçalinho","A Capela de São Gonçalinho, situada no bairro da Beira-Mar, em Aveiro, é um pequeno templo de origem medieval, dedicado a São Gonçalo de Amarante. A capela, reconstruída no século XVI, é conhecida pela sua original arquitetura, com uma cúpula bolbosa revestida a azulejos, e pelas festas em honra do santo, que se realizam em janeiro. Durante as festas, os devotos atam cebolas às vestes do santo, como forma de agradecimento por graças alcançadas, e lançam cavacas da cúpula da capela para a multidão. A capela está classificada como Imóvel de Interesse Público e é um dos símbolos da identidade cultural da cidade. A sua localização, junto aos canais da ria, torna-a um local pitoresco e muito fotografado por visitantes.",Aveiro
"Parque da Cidade de Aveiro","O Parque da Cidade de Aveiro, também conhecido como Parque da Baixa de Santo António, é um espaço verde localizado no coração da cidade. O parque, inaugurado em 1995, ocupa uma área de 10 hectares e inclui um lago, um anfiteatro ao ar livre, um parque infantil e um circuito de manutenção. O lago, atravessado por pontes pedonais, é habitado por patos, cisnes e outras aves aquáticas, que tornam o local aprazível para passeios e piqueniques. O parque é, também, um local de realização de eventos culturais e desportivos, como concertos, feiras e maratonas. A sua proximidade do centro histórico e dos canais da ria fazem do Parque da Cidade um local de eleição para o lazer e o convívio dos aveirenses e visitantes.",Aveiro
"Ecomuseu Marinha da Troncalhada","O Ecomuseu Marinha da Troncalhada, situado na ria de Aveiro, é um espaço museológico ao ar livre, dedicado à preservação e divulgação das salinas tradicionais. O ecomuseu inclui um percurso interpretativo, que permite conhecer o processo de produção do sal, as técnicas utilizadas pelos marnotos (salinicultores) e a biodiversidade associada às salinas. As salinas da Troncalhada, em funcionamento desde o século XIX, são um exemplo do património cultural e natural da região, albergando espécies de aves como o perna-longa, o borrelho-de-coleira-interrompida e o flamingo. O ecomuseu oferece, ainda, atividades pedagógicas e workshops, que visam sensibilizar os visitantes para a importância da preservação das salinas e da sua biodiversidade. A visita ao Ecomuseu Marinha da Troncalhada é uma oportunidade única para contactar com as tradições salícolas e a paisagem única da ria.",Aveiro
"Cais da Ribeira de Esgueira","O Cais da Ribeira de Esgueira, situado na freguesia de Esgueira, em Aveiro, é um antigo porto de pesca, que testemunha a importância da atividade piscatória na região. O cais, recuperado e requalificado, é hoje um local de lazer e de contemplação da ria, com vários restaurantes e esplanadas, onde se pode saborear peixe e marisco fresco. O cais é, também, um local de partida para passeios de barco pela ria de Aveiro, que permitem explorar os canais, as salinas e os esteiros, e observar a fauna e flora características. A Ribeira de Esgueira mantém o seu carácter tradicional, com as suas casas de pescadores e os seus barcos moliceiros atracados, oferecendo uma imagem autêntica da vida na ria.",Esgueira
"Ponte dos Namorados","A Ponte dos Namorados, também conhecida como Ponte do Laço, é uma ponte pedonal situada no canal do Côjo, em Aveiro. A ponte, de estrutura metálica, é decorada com laços coloridos, colocados pelos namorados como símbolo do seu amor. A tradição, semelhante à do Ponte dos cadeados de Paris, tornou a ponte num local romântico e muito procurado por casais. A ponte oferece uma vista pitoresca sobre os canais da ria e as coloridas fachadas dos edifícios da cidade. A sua localização, próximo da praça do Peixe e do mercado do peixe, torna-a um ponto de passagem obrigatório para quem visita Aveiro. A Ponte dos Namorados é, assim, um símbolo do carácter acolhedor e romântico da cidade.",Aveiro
"Praça do Peixe","A Praça do Peixe, situada no coração de Aveiro, é um espaço histórico, outrora dedicado à venda de peixe. A praça, rodeada por edifícios de arquitetura tradicional, é hoje um local de restauração, com vários restaurantes e esplanadas, onde se pode degustar a gastronomia regional, com destaque para as enguias de caldeirada, o bacalhau e os mariscos. No centro da praça, ergue-se um chafariz de ferro, que outrora abastecia a população de água. A Praça do Peixe é, também, um local de realização de eventos culturais, como feiras, concertos e exposições. A sua proximidade dos canais e dos principais monumentos da cidade fazem dela um local animado e de grande afluência, tanto de locais como de turistas.",Aveiro
"Fábrica da Ciência Viva","A Fábrica da Ciência Viva, situada em Aveiro, é um centro de ciência e tecnologia, que tem como objetivo promover a cultura científica e tecnológica junto do público em geral. O centro, instalado numa antiga fábrica de cerâmica, inclui exposições interativas, laboratórios, um auditório e um planetário. As exposições, de caráter lúdico e educativo, abordam temas como a física, a química, a biologia, a robótica e a astronomia. A Fábrica da Ciência Viva oferece, ainda, um vasto programa de atividades, como workshops, palestras, observações astronómicas e campos de férias, destinados a crianças, jovens e adultos. O centro é um espaço de descoberta e aprendizagem, que estimula a curiosidade e o gosto pela ciência, contribuindo para a formação de cidadãos mais informados e críticos.",Aveiro
"Estação de Comboios de Aveiro","A Estação de Comboios de Aveiro, inaugurada em 1916, é um dos edifícios mais emblemáticos da cidade, conhecido pelos seus painéis de azulejos que revestem as fachadas. Os azulejos, da autoria de Licínio Pinto, representam cenas da vida tradicional da região, como a pesca, a apanha do moliço, a produção de sal e as festas populares. A estação, de arquitetura revivalista, é um exemplo notável da aplicação do azulejo como elemento decorativo e narrativo. O interior do edifício mantém a sua traça original, com bilheteiras em madeira e bancos de época. A Estação de Aveiro é, não só um importante nó ferroviário, que liga a cidade ao resto do país, mas também um monumento de interesse artístico e cultural, que merece uma visita atenta.",Aveiro
"Capela do Senhor das Barrocas","A Capela do Senhor das Barrocas, situada em Aveiro, é um notável exemplo da arquitetura barroca portuguesa. A capela, construída no século XVIII, é conhecida pela sua fachada ricamente decorada, com elementos em talha dourada, azulejos e estátuas. O interior, de planta centralizada, é revestido a talha dourada, criando um efeito de grande riqueza e movimento. O altar-mor, dedicado ao Senhor das Barrocas, é uma obra-prima da talha barroca, com colunas salomónicas, anjos e motivos florais. A capela está classificada como Monumento Nacional e é um local de culto e de peregrinação, especialmente durante a festa em honra do Senhor das Barrocas, que se realiza em setembro. A sua localização, no centro da cidade, torna-a um ponto de referência do património religioso aveirense.",Aveiro
