Title,Description,LocationName
"Museu de Aveiro","O Museu de Aveiro, instalado no antigo Convento de Jesus, é um dos mais importantes museus de arte sacra de Portugal. O museu, fundado em 1911, ocupa as dependências do convento, onde viveu e morreu a Princesa Santa Joana, filha do rei D. Afonso V. O acervo do museu inclui pintura, escultura, ourivesaria, têxteis e cerâmica, dos séculos XV ao XVIII, com destaque para o túmulo de Santa Joana, uma obra-prima do renascimento português. As salas do museu, como a sala do capítulo, a capela-mor e os claustros, conservam a sua decoração original, com azulejos, talha dourada e pinturas murais. O Museu de Aveiro é, não só um repositório de arte e história, mas também um local de memória da vida conventual e da devoção a Santa Joana, padroeira da cidade.",Aveiro
"Palácio do Gelo","O Palácio do Gelo, situado em Viseu, é um centro comercial que inclui uma pista de gelo, única em Portugal. O complexo, inaugurado em 2008, é um espaço de comércio, lazer e entretenimento, com mais de 100 lojas, um hipermercado, um cinema, um bowling e vários restaurantes. A pista de gelo, com 600 m², é o ex-libris do Palácio do Gelo, atraindo visitantes de todo o país para praticar patinagem no gelo, hockey e curling. O centro oferece, ainda, atividades como escalada, karting e jogos de realidade virtual. O Palácio do Gelo é, assim, um local de eleição para compras e diversão, para todas as idades, tornando-se um dos pontos de referência da cidade de Viseu.",Viseu
"Parque Aquilino Ribeiro","O Parque Aquilino Ribeiro, também conhecido como Parque da Cidade de Viseu, é um espaço verde localizado no centro da cidade. O parque, inaugurado em 1933, ocupa uma área de 8 hectares e inclui um lago, um coreto, um parque infantil e um quiosque. O lago, habitado por patos e cisnes, é atravessado por pontes pedonais e rodeado por árvores centenárias, que proporcionam sombra e frescura. O parque é um local de lazer e convívio para os viseenses, ideal para passeios, jogos e piqueniques. A sua localização, próximo do centro histórico e da Sé de Viseu, torna-o um local de passagem obrigatória para quem visita a cidade. O Parque Aquilino Ribeiro é, também, um palco de eventos culturais, como concertos, feiras e exposições.",Viseu
"Sé de Viseu","A Sé de Viseu, também conhecida como Catedral de Viseu, é um dos mais importantes monumentos religiosos da cidade. A catedral, construída no século XIII, sofreu várias alterações ao longo dos séculos, adquirindo a sua atual feição maneirista no século XVII. A fachada principal, com as suas duas torres sineiras, é um exemplo do estilo chão, característico da arquitetura religiosa portuguesa da época. No interior, destacam-se o claustro renascentista, a capela-mor, com o seu retábulo em talha dourada, e o cadeiral do coro alto, uma obra-prima da talha barroca. A sé está classificada como Monumento Nacional e é um local de culto e de visita obrigatória para quem quer conhecer a história e a arte de Viseu. O museu da sé, instalado no claustro, exibe um acervo de arte sacra, com peças de ourivesaria, pintura e escultura.",Viseu
"Museu Nacional Grão Vasco","O Museu Nacional Grão Vasco, situado no centro histórico de Viseu, é um dos mais importantes museus de arte antiga de Portugal. O museu, instalado no antigo Paço Episcopal, exibe uma coleção de pintura, escultura, ourivesaria e cerâmica, dos séculos XII ao XIX, com destaque para as obras do pintor renascentista Vasco Fernandes, conhecido como Grão Vasco. As pinturas de Grão Vasco, como o ""Pentecostes"", a ""Criação dos Animais"" e a ""Adoração dos Magos"", são consideradas obras-primas da pintura portuguesa do século XVI. O museu possui, ainda, uma notável coleção de arte sacra, com peças provenientes de igrejas e conventos da região. O edifício do Paço Episcopal, com a sua arquitetura solene e os seus claustros, é, por si só, um monumento de grande valor histórico e artístico.",Viseu
"Igreja da Misericórdia de Viseu","A Igreja da Misericórdia de Viseu, construída no século XVI, é um notável exemplo da arquitetura maneirista portuguesa. A igreja, de nave única, possui uma fachada sóbria, com um portal encimado por um frontão triangular. No interior, destaca-se o retábulo do altar-mor, em talha dourada, com pinturas atribuídas a Vasco Fernandes (Grão Vasco). A capela-mor, coberta por uma abóbada de berço, é revestida a azulejos do século XVIII, que representam cenas da vida de Cristo. A igreja está classificada como Imóvel de Interesse Público e é um local de culto e de visita, que testemunha a importância da Santa Casa da Misericórdia na história social e religiosa da cidade. A sua localização, na praça da Sé, torna-a um elemento central do conjunto monumental viseense.",Viseu
"Parque do Fontelo","O Parque do Fontelo, situado na periferia de Viseu, é um espaço verde de grande beleza, que ocupa a antiga cerca do Paço Episcopal. O parque, do século XVI, inclui um palacete renascentista, uma capela, um estádio municipal e várias fontes e lagos. Os jardins, de inspiração italiana, são compostos por sebes, canteiros e alamedas arborizadas, que criam um ambiente de tranquilidade e romantismo. O parque é um local de lazer para os viseenses, ideal para caminhadas, jogos e piqueniques. O estádio do Fontelo, com o seu passado desportivo, é, atualmente, um espaço polidesportivo, que acolhe eventos culturais e desportivos. O Parque do Fontelo é, assim, um refúgio verde no coração da cidade, que combina história, natureza e desporto.",Viseu
"Cava de Viriato","A Cava de Viriato, situada em Viseu, é um monumento arqueológico único em Portugal, consistindo num octógono de terraplenos e fossos, com cerca de 38 hectares. A origem e função da Cava são ainda hoje motivo de debate entre os historiadores, tendo sido interpretada como um acampamento militar romano, uma estrutura defensiva ou um recinto sagrado. A lenda popular associa-a ao líder lusitano Viriato, que teria aqui estabelecido o seu quartel-general durante a resistência à invasão romana. A Cava de Viriato está classificada como Monumento Nacional e é um local de grande interesse histórico e paisagístico, rodeado por um parque arborizado, ideal para passeios e desporto. No centro do octógono, ergue-se uma estátua de Viriato, da autoria do escultor Mariano Benlliure, inaugurada em 1940.",Viseu
"Capela de São Mateus","A Capela de São Mateus, situada no Monte de São Mateus, em Viseu, é um pequeno templo de origem medieval, que oferece uma vista panorâmica sobre a cidade e a serra do Caramulo. A capela, reconstruída no século XVIII, é dedicada a São Mateus, padroeiro dos cobradores de impostos, e é local de peregrinação durante a festa em honra do santo, que se realiza em setembro. O adro da capela, com a sua cruz de pedra e os seus bancos, é um local de contemplação e de descanso, muito procurado pelos visitantes. O acesso ao Monte de São Mateus é feito por uma estrada sinuosa, que serpenteia pela encosta, oferecendo, ao longo do percurso, várias perspetivas sobre a cidade. A capela e o miradouro são pontos de referência da paisagem viseense.",Viseu
"Feira de São Mateus","A Feira de São Mateus, realizada anualmente em Viseu, é uma das mais antigas e importantes feiras de Portugal, com origens que remontam ao século XIII. A feira, que se realiza no recinto da Feira de São Mateus, no Parque da Cidade, dura cerca de um mês, de agosto a setembro, e inclui uma diversidade de atividades, como parques de diversões, concertos, espetáculos de folclore, feira de artesanato e tasquinhas com gastronomia regional. A Feira de São Mateus é um evento de grande tradição e popularidade, que atrai visitantes de todo o país, contribuindo para a animação e dinamização da cidade. A feira é, também, um espaço de promoção dos produtos regionais, como o vinho do Dão, o queijo da serra e o fumeiro.",Viseu
"Muralhas de Viseu","As Muralhas de Viseu, também conhecidas como Cerca Velha ou Muralhas do Românico, são um conjunto de fortificações que protegiam a cidade medieval. As muralhas, construídas entre os séculos XII e XIII, foram sendo integradas no tecido urbano, à medida que a cidade se expandia. Atualmente, restam alguns troços das muralhas, bem como duas portas: a Porta do Soar, também conhecida como Arco dos Melos, e a Porta de São Francisco. A Porta do Soar, de arco quebrado, é a mais bem conservada e dá acesso ao centro histórico. As muralhas estão classificadas como Monumento Nacional e são um testemunho da importância estratégica de Viseu na Idade Média. O percurso ao longo das muralhas permite descobrir vestígios do passado medieval da cidade e desfrutar de vistas sobre o casario histórico.",Viseu
"Igreja dos Terceiros de São Francisco","A Igreja dos Terceiros de São Francisco, situada em Viseu, é um notável exemplo da arquitetura barroca portuguesa. A igreja, construída no século XVIII, pertenceu à Ordem Terceira de São Francisco, uma confraria de leigos. A fachada, de linhas curvas e movimento, é decorada com elementos em talha dourada e azulejos. O interior, de nave única, é revestido a talha dourada, criando um efeito de grande riqueza e teatralidade. O altar-mor, dedicado a Nossa Senhora da Conceição, é uma obra-prima da talha barroca, com colunas salomónicas, anjos e motivos florais. A igreja está classificada como Imóvel de Interesse Público e é um local de culto e de visita, que testemunha o fervor religioso e o mecenato artístico da Ordem Terceira em Viseu.",Viseu
"Solar do Vinho do Dão","O Solar do Vinho do Dão, situado em Viseu, é um espaço dedicado à promoção e divulgação dos vinhos da região do Dão. O solar, instalado num edifício histórico do século XVIII, inclui uma enoteca, uma sala de provas, um auditório e uma loja. A enoteca oferece uma vasta seleção de vinhos do Dão, que podem ser degustados no local ou adquiridos. O Solar do Vinho do Dão organiza, ainda, atividades como workshops de enologia, provas comentadas e jantares temáticos, que visam dar a conhecer a diversidade e a qualidade dos vinhos da região. O espaço é, também, um local de realização de eventos culturais, como exposições, concertos e lançamentos de livros. O Solar do Vinho do Dão é, assim, um ponto de encontro para os amantes do vinho e da cultura.",Viseu
"Miradouro do Monte do Pilar","O Miradouro do Monte do Pilar, situado em Viseu, oferece uma vista panorâmica sobre a cidade, a serra do Caramulo e a serra da Estrela. O miradouro, localizado a 618 metros de altitude, é um local de eleição para contemplar o pôr-do-sol e para fotografar a paisagem. No local, ergue-se a capela de Nossa Senhora do Pilar, um pequeno templo de origem medieval, que foi reconstruído no século XVIII. O miradouro é, também, um ponto de partida para percursos pedestres e de BTT, que exploram a serra do Caramulo e os seus valores naturais. O acesso ao Monte do Pilar é feito por uma estrada florestal, que serpenteia pela encosta, oferecendo, ao longo do percurso, várias perspetivas sobre a cidade e a serra.",Viseu
"Jardim das Mães","O Jardim das Mães, situado no centro de Viseu, é um espaço verde dedicado às mães da cidade. O jardim, inaugurado em 1952, inclui um lago com patos, um coreto, um parque infantil e um quiosque. O lago, atravessado por uma ponte pedonal, é rodeado por canteiros de flores e árvores, que proporcionam sombra e frescura. O jardim é um local de lazer para famílias, ideal para passeios, jogos e piqueniques. A sua localização, próximo da avenida da Europa e do Parque Aquilino Ribeiro, torna-o um local de passagem e de convívio para os viseenses. O Jardim das Mães é, também, um palco de eventos culturais, como concertos, feiras e exposições, contribuindo para a animação da cidade.",Viseu
"Teatro Viriato","O Teatro Viriato, situado em Viseu, é um dos mais importantes espaços culturais da cidade. O teatro, instalado num edifício do século XIX, foi recuperado e modernizado, mantendo a sua fachada histórica. A sala de espetáculos, com capacidade para 400 pessoas, acolhe uma programação diversificada, que inclui teatro, dança, música, ópera e cinema. O Teatro Viriato é, também, um centro de criação artística, com residências para artistas e projetos educativos, que visam formar novos públicos. O teatro contribui, decisivamente, para a vida cultural de Viseu, promovendo a difusão das artes performativas e o acesso à cultura. A sua localização, no centro da cidade, torna-o um ponto de referência para os amantes das artes.",Viseu
"Ponte da Pedra","A Ponte da Pedra, também conhecida como Ponte Medieval de Vildemoinhos, é uma ponte de origem romana, reconstruída na Idade Média. A ponte, situada sobre o rio Pavia, na freguesia de Vildemoinhos, é composta por três arcos de volta perfeita, em granito. A ponte está classificada como Imóvel de Interesse Público e é um testemunho da importância das vias de comunicação na região. A sua localização, numa zona rural, rodeada por campos e matas, torna-a um local pitoresco e tranquilo, ideal para passeios e piqueniques. A Ponte da Pedra é, também, um ponto de partida para percursos pedestres e de BTT, que exploram o vale do rio Pavia e os seus valores naturais e culturais.",Vildemoinhos
"Capela de Nossa Senhora da Vitória","A Capela de Nossa Senhora da Vitória, situada no Monte de São Luís, em Viseu, é um pequeno templo de origem medieval, que comemora a vitória das tropas portuguesas na Batalha de Aljubarrota, em 1385. A capela, reconstruída no século XVIII, é dedicada a Nossa Senhora da Vitória, padroeira dos combatentes. O interior, de nave única, é decorado com azulejos do século XVIII, que representam cenas da batalha. A capela está classificada como Imóvel de Interesse Público e é um local de culto e de peregrinação, especialmente durante a festa em honra de Nossa Senhora da Vitória, que se realiza em agosto. O miradouro anexo à capela oferece uma vista deslumbrante sobre a cidade e a serra do Caramulo.",Viseu
"Parque Biológico de Viseu","O Parque Biológico de Viseu, situado na Quinta da Cruz, é um espaço dedicado à educação ambiental e à conservação da natureza. O parque, inaugurado em 2013, ocupa uma área de 14 hectares e inclui um centro de interpretação, um viveiro de plantas autóctones, um percurso pedestre e várias estações temáticas. O percurso, com 2,5 km, permite observar a flora e fauna locais, com destaque para as aves, os anfíbios e os répteis. O parque oferece, ainda, atividades pedagógicas, como workshops, saídas de campo e campos de férias, que visam sensibilizar os visitantes para a importância da biodiversidade e da sustentabilidade. O Parque Biológico de Viseu é, assim, um local de descoberta e aprendizagem, que promove o contacto com a natureza e a adoção de comportamentos ambientalmente responsáveis.",Viseu
"Fundação Lapa do Lobo","A Fundação Lapa do Lobo, situada no concelho de Nelas, é um centro cultural que tem como objetivo a promoção das artes e da cultura. A fundação, instalada numa antiga quinta, inclui um auditório, uma galeria de exposições, uma biblioteca e um parque escultórico. A programação da fundação é diversificada, incluindo concertos, exposições, teatro, dança, cinema e residências artísticas. O parque escultórico, com obras de artistas nacionais e internacionais, é um espaço de diálogo entre a arte e a natureza. A Fundação Lapa do Lobo é, também, um local de realização de eventos como festivais, encontros e conferências, que atraem públicos de várias idades e interesses. A sua localização, no coração da região do Dão, torna-a um polo cultural de referência, que contribui para a dinamização da vida artística da região.",Nelas
"Castelo de Penalva","O Castelo de Penalva, também conhecido como Castelo de Pindo, é uma fortificação medieval situada no concelho de Penalva do Castelo. O castelo, construído no século XII, foi um importante ponto de defesa da região durante a Reconquista Cristã. Do conjunto fortificado, restam a torre de menagem, de planta quadrangular, e alguns troços das muralhas. A torre, com 20 metros de altura, oferece uma vista panorâmica sobre a vila de Penalva do Castelo e a serra da Estrela. O castelo está classificado como Imóvel de Interesse Público e é um local de grande interesse histórico e paisagístico. O acesso ao castelo é feito por um caminho pedonal, que serpenteia pela encosta, oferecendo, ao longo do percurso, vistas sobre a paisagem envolvente.",Penalva do Castelo
"Pelourinho de Penalva do Castelo","O Pelourinho de Penalva do Castelo, situado no Largo do Pelourinho, é um símbolo do poder municipal e da autonomia da vila. O pelourinho, de estilo manuelino, foi construído no século XVI, após a concessão do foral por D. Manuel I, em 1515. A coluna, de fuste oitavado, é encimada por um capitel decorado com esferas armilares e a esfera armilar, símbolos do rei D. Manuel I. O pelourinho está classificado como Imóvel de Interesse Público e é um testemunho da importância histórica de Penalva do Castelo. A sua localização, no centro da vila, junto à igreja matriz e aos antigos paços do concelho, torna-o um elemento central do conjunto patrimonial local.",Penalva do Castelo
"Igreja Matriz de Penalva do Castelo","A Igreja Matriz de Penalva do Castelo, dedicada a São Pedro, é um templo de origem românica, reconstruído no século XVI. A igreja, de nave única, possui uma fachada sóbria, com um portal maneirista. No interior, destacam-se o retábulo do altar-mor, em talha dourada, com pinturas do século XVII, e a pia batismal, de estilo românico. A capela-mor, coberta por uma abóbada de berço, é revestida a azulejos do século XVIII, que representam cenas da vida de São Pedro. A igreja está classificada como Imóvel de Interesse Público e é um local de culto e de visita, que testemunha a evolução da arte religiosa na região. A sua localização, no centro da vila, torna-a um ponto de referência do património cultural de Penalva do Castelo.",Penalva do Castelo
"Anta de Penalva do Castelo","A Anta de Penalva do Castelo, também conhecida como Dólmen da Orca, é um monumento megalítico situado no concelho de Penalva do Castelo. A anta, construída no Neolítico, há cerca de 5000 anos, era uma sepultura coletiva, composta por uma câmara funerária e um corredor de acesso. A câmara, de planta poligonal, é formada por sete esteios, cobertos por uma laje de granito. O corredor, com 4 metros de comprimento, dá acesso à câmara. A anta está classificada como Imóvel de Interesse Público e é um testemunho da ocupação humana do território desde a Pré-História. O monumento está inserido numa paisagem rural, rodeado por campos e matas, ideal para passeios e contemplação.",Penalva do Castelo
"Miradouro da Senhora do Viso","O Miradouro da Senhora do Viso, situado no Monte do Viso, em Penalva do Castelo, oferece uma vista panorâmica sobre a vila, o castelo e a serra da Estrela. O miradouro, localizado a 585 metros de altitude, é um local de eleição para contemplar a paisagem e para fotografar o pôr-do-sol. No local, ergue-se a capela de Nossa Senhora do Viso, um pequeno templo de origem medieval, que foi reconstruído no século XVIII. O miradouro é, também, um ponto de partida para percursos pedestres e de BTT, que exploram a serra do Viso e os seus valores naturais. O acesso ao Monte do Viso é feito por uma estrada florestal, que serpenteia pela encosta, oferecendo, ao longo do percurso, várias perspetivas sobre a vila e a serra.",Penalva do Castelo
"Parque de Merendas do Viso","O Parque de Merendas do Viso, situado no Monte do Viso, em Penalva do Castelo, é um espaço de lazer, ideal para piqueniques e convívios. O parque, equipado com mesas, bancos, grelhadores e fontanários, está inserido numa área florestal, com sombra e tranquilidade. A proximidade do miradouro da Senhora do Viso e da capela torna-o um local aprazível para descansar após uma caminhada ou para desfrutar de um almoço em família. O parque é, também, um ponto de partida para percursos pedestres e de BTT, que exploram a serra do Viso e os seus valores naturais e culturais. O Parque de Merendas do Viso é, assim, um local de eleição para contactar com a natureza e usufruir do ar puro da serra.",Penalva do Castelo
"Rota dos Moinhos de Água","A Rota dos Moinhos de Água, situada no concelho de Penalva do Castelo, é um percurso pedestre que permite descobrir os antigos moinhos de água que outrora povoavam as margens dos rios e ribeiras da região. A rota, com cerca de 10 km, passa por vários moinhos, alguns deles recuperados, que testemunham a importância da moagem de cereais na economia local. O percurso, sinalizado, serpenteia por caminhos rurais, atravessando pontes, levadas e açudes, e oferece vistas sobre a paisagem agrícola e florestal. A Rota dos Moinhos de Água é, não só um percurso de interesse histórico e etnográfico, mas também uma oportunidade para contactar com a natureza e desfrutar da tranquilidade do mundo rural.",Penalva do Castelo
"Festas de São Pedro","As Festas de São Pedro, realizadas anualmente em Penalva do Castelo, são as festas em honra do padroeiro da vila. As festas, que se realizam no final de junho, incluem uma procissão, uma feira tradicional, concertos, espetáculos de folclore e tasquinhas com gastronomia regional. O ponto alto das festas é a procissão de São Pedro, que percorre as ruas da vila, acompanhada pela banda filarmónica e pelos andores. As Festas de São Pedro são um evento de grande tradição e popularidade, que reúne a comunidade local e atrai visitantes das aldeias vizinhas. As festas são, também, uma oportunidade para promover os produtos regionais, como o vinho do Dão, o queijo e o fumeiro, e para animar a vila durante o verão.",Penalva do Castelo
"Centro de Interpretação do Castelo","O Centro de Interpretação do Castelo, situado em Penalva do Castelo, é um espaço dedicado à história e ao património do castelo e da vila. O centro, instalado num edifício recuperado, inclui uma exposição permanente, que apresenta a evolução do castelo, desde a sua construção até aos nossos dias, e a história de Penalva do Castelo. A exposição, com recurso a meios tecnológicos e a objetos arqueológicos, permite aos visitantes compreender a importância estratégica do castelo e o seu papel na defesa da região. O centro oferece, ainda, atividades pedagógicas, como workshops e visitas guiadas, que visam sensibilizar os visitantes para a preservação do património. O Centro de Interpretação do Castelo é, assim, um ponto de partida para explorar o castelo e a vila.",Penalva do Castelo
"Arquivo Municipal","O Arquivo Municipal de Penalva do Castelo, situado no edifício dos antigos paços do concelho, é um espaço dedicado à preservação e divulgação da documentação histórica do concelho. O arquivo, fundado em 1998, reúne um acervo documental que inclui livros de atas, registos paroquiais, mapas, fotografias e postais, dos séculos XVI ao XX. O arquivo está aberto ao público, permitindo a consulta de documentos para fins de investigação histórica e genealógica. O edifício dos antigos paços do concelho, de arquitetura tradicional, é, por si só, um monumento de interesse histórico, que testemunha a evolução da administração local. O Arquivo Municipal é, assim, um local de memória, que contribui para o conhecimento da história de Penalva do Castelo e da sua gente.",Penalva do Castelo
"Biblioteca Municipal","A Biblioteca Municipal de Penalva do Castelo, situada no centro da vila, é um espaço de leitura, estudo e lazer. A biblioteca, inaugurada em 2005, inclui uma sala de leitura, uma sala infanto-juvenil, um espaço multimédia e um auditório. O acervo da biblioteca é constituído por livros, revistas, jornais, DVDs e CDs, abrangendo várias áreas do conhecimento. A biblioteca oferece, ainda, atividades como horas do conto, workshops, exposições e encontros com escritores, que visam promover o gosto pela leitura e a formação de leitores. A Biblioteca Municipal é, também, um local de realização de eventos culturais, como conferências, lançamentos de livros e concertos, contribuindo para a dinamização da vida cultural da vila.",Penalva do Castelo
"Parque Urbano de Penalva do Castelo","O Parque Urbano de Penalva do Castelo, situado na periferia da vila, é um espaço verde de lazer e convívio. O parque, inaugurado em 2010, inclui um lago, um parque infantil, um circuito de manutenção, um anfiteatro ao ar livre e um parque de merendas. O lago, habitado por patos e cisnes, é atravessado por pontes pedonais e rodeado por árvores e canteiros de flores. O parque é um local de eleição para passeios, jogos e piqueniques, para famílias e grupos de amigos. A sua localização, próximo do centro da vila e do castelo, torna-o um local de passagem e de descanso para os visitantes. O Parque Urbano é, também, um palco de eventos culturais e desportivos, como concertos, feiras e maratonas.",Penalva do Castelo
